### ISSUE TITLE
Can't connect to Kafka 0.8

### ISSUE THREAD

**Issue by jwatte** [Shopify/sarama#824]
##### Versions

Sarama Version: 1579b0648e644d89245378ce3bbdd284f19825d9
Kafka Version: 0.8
Go Version: go version go1.6.1 linux/amd64

##### Configuration

Kafka 0.8, Two brokers, five ZK nodes

###### TCPDUMP:
$ sudo tcpdump -i any -s 10240 -X tcp port 9092
tcpdump: verbose output suppressed, use -v or -vv for full protocol decode
listening on any, link-type LINUX_SLL (Linux cooked), capture size 10240 bytes
12:14:39.042294 IP AF002173.prod.imvu.com.9092 > di-admin.prod.imvu.com.60375: Flags [S.], seq 3217120246, ack 4271602289, win 28960, options [mss 1400,sackOK,TS val 3911311672 ecr 3928743204,nop,wscale 2], length 0
        0x0000:  4500 003c 0000 4000 4006 0f2c 0a0a 087d  E..<..@.@..,...}
        0x0010:  0a01 0f09 2384 ebd7 bfc1 5bf6 fe9b 7a71  ....#.....[...zq
        0x0020:  a012 7120 75b3 0000 0204 0578 0402 080a  ..q.u......x....
        0x0030:  e921 e138 ea2b dd24 0103 0302            .!.8.+.$....
12:14:39.042322 IP di-admin.prod.imvu.com.60375 > AF002173.prod.imvu.com.9092: Flags [.], ack 1, win 229, options [nop,nop,TS val 3928743204 ecr 3911311672], length 0
        0x0000:  4500 0034 a755 4000 4006 67de 0a01 0f09  E..4.U@.@.g.....
        0x0010:  0a0a 087d ebd7 2384 fe9b 7a71 bfc1 5bf7  ...}..#...zq..[.
        0x0020:  8010 00e5 2bb7 0000 0101 080a ea2b dd24  ....+........+.$
        0x0030:  e921 e138                                .!.8
12:14:39.042554 IP di-admin.prod.imvu.com.60375 > AF002173.prod.imvu.com.9092: Flags [P.], seq 1:25, ack 1, win 229, options [nop,nop,TS val 3928743204 ecr 3911311672], length 24
        0x0000:  4500 004c a756 4000 4006 67c5 0a01 0f09  E..L.V@.@.g.....
        0x0010:  0a0a 087d ebd7 2384 fe9b 7a71 bfc1 5bf7  ...}..#...zq..[.
        0x0020:  8018 00e5 2bcf 0000 0101 080a ea2b dd24  ....+........+.$
        0x0030:  e921 e138 0000 0014 0003 0000 0000 0000  .!.8............
        0x0040:  0006 7361 7261 6d61 0000 0000            ..sarama....
12:14:39.042689 IP AF002173.prod.imvu.com.9092 > di-admin.prod.imvu.com.60375: Flags [.], ack 25, win 7240, options [nop,nop,TS val 3911311672 ecr 3928743204], length 0
        0x0000:  4500 0034 bacf 4000 4006 5464 0a0a 087d  E..4..@.@.Td...}
        0x0010:  0a01 0f09 2384 ebd7 bfc1 5bf7 fe9b 7a89  ....#.....[...z.
        0x0020:  8010 1c48 f8fe 0000 0101 080a e921 e138  ...H.........!.8
        0x0030:  ea2b dd24                                .+.$
12:15:09.042803 IP di-admin.prod.imvu.com.60375 > AF002173.prod.imvu.com.9092: Flags [F.], seq 25, ack 1, win 229, options [nop,nop,TS val 3928750704 ecr 3911311672], length 0
        0x0000:  4500 0034 a757 4000 4006 67dc 0a01 0f09  E..4.W@.@.g.....
        0x0010:  0a0a 087d ebd7 2384 fe9b 7a89 bfc1 5bf7  ...}..#...z...[.
        0x0020:  8011 00e5 2bb7 0000 0101 080a ea2b fa70  ....+........+.p
        0x0030:  e921 e138                                .!.8
12:15:09.043187 IP AF002173.prod.imvu.com.9092 > di-admin.prod.imvu.com.60375: Flags [F.], seq 1, ack 26, win 7240, options [nop,nop,TS val 3911319172 ecr 3928750704], length 0
        0x0000:  4500 0034 bad0 4000 4006 5463 0a0a 087d  E..4..@.@.Tc...}
        0x0010:  0a01 0f09 2384 ebd7 bfc1 5bf7 fe9b 7a8a  ....#.....[...z.
        0x0020:  8011 1c48 be64 0000 0101 080a e921 fe84  ...H.d.......!..
        0x0030:  ea2b fa70                                .+.p
12:15:09.043218 IP di-admin.prod.imvu.com.60375 > AF002173.prod.imvu.com.9092: Flags [.], ack 2, win 229, options [nop,nop,TS val 3928750704 ecr 3911319172], length 0
        0x0000:  4500 0034 a758 4000 4006 67db 0a01 0f09  E..4.X@.@.g.....
        0x0010:  0a0a 087d ebd7 2384 fe9b 7a8a bfc1 5bf8  ...}..#...z...[.
        0x0020:  8010 00e5 2bb7 0000 0101 080a ea2b fa70  ....+........+.p
        0x0030:  e921 fe84                                .!..
12:15:09.043609 IP di-admin.prod.imvu.com.50598 > AF002172.prod.imvu.com.9092: Flags [S], seq 526994864, win 29200, options [mss 1400,sackOK,TS val 3928750704 ecr 0,nop,wscale 7], length 0
        0x0000:  4500 003c b7c0 4000 4006 576c 0a01 0f09  E..<..@.@.Wl....
        0x0010:  0a0a 087c c5a6 2384 1f69 4db0 0000 0000  ...|..#..iM.....
        0x0020:  a002 7210 2bbe 0000 0204 0578 0402 080a  ..r.+......x....
        0x0030:  ea2b fa70 0000 0000 0103 0307            .+.p........
12:15:09.043823 IP AF002172.prod.imvu.com.9092 > di-admin.prod.imvu.com.50598: Flags [S.], seq 603010878, ack 526994865, win 28960, options [mss 1400,sackOK,TS val 3911327441 ecr 3928750704,nop,wscale 2], length 0
        0x0000:  4500 003c 0000 4000 4006 0f2d 0a0a 087c  E..<..@.@..-...|
        0x0010:  0a01 0f09 2384 c5a6 23f1 373e 1f69 4db1  ....#...#.7>.iM.
        0x0020:  a012 7120 0d7c 0000 0204 0578 0402 080a  ..q..|.....x....
        0x0030:  e922 1ed1 ea2b fa70 0103 0302            ."...+.p....
12:15:09.043842 IP di-admin.prod.imvu.com.50598 > AF002172.prod.imvu.com.9092: Flags [.], ack 1, win 229, options [nop,nop,TS val 3928750704 ecr 3911327441], length 0
        0x0000:  4500 0034 b7c1 4000 4006 5773 0a01 0f09  E..4..@.@.Ws....
        0x0010:  0a0a 087c c5a6 2384 1f69 4db1 23f1 373f  ...|..#..iM.#.7?
        0x0020:  8010 00e5 2bb6 0000 0101 080a ea2b fa70  ....+........+.p
        0x0030:  e922 1ed1                                ."..
12:15:09.043923 IP di-admin.prod.imvu.com.50598 > AF002172.prod.imvu.com.9092: Flags [P.], seq 1:25, ack 1, win 229, options [nop,nop,TS val 3928750704 ecr 3911327441], length 24
        0x0000:  4500 004c b7c2 4000 4006 575a 0a01 0f09  E..L..@.@.WZ....
        0x0010:  0a0a 087c c5a6 2384 1f69 4db1 23f1 373f  ...|..#..iM.#.7?
        0x0020:  8018 00e5 2bce 0000 0101 080a ea2b fa70  ....+........+.p
        0x0030:  e922 1ed1 0000 0014 0003 0000 0000 0000  ."..............
        0x0040:  0006 7361 7261 6d61 0000 0000            ..sarama....
12:15:09.044051 IP AF002172.prod.imvu.com.9092 > di-admin.prod.imvu.com.50598: Flags [.], ack 25, win 7240, options [nop,nop,TS val 3911327441 ecr 3928750704], length 0
        0x0000:  4500 0034 29ee 4000 4006 e546 0a0a 087c  E..4).@.@..F...|
        0x0010:  0a01 0f09 2384 c5a6 23f1 373f 1f69 4dc9  ....#...#.7?.iM.
        0x0020:  8010 1c48 90c7 0000 0101 080a e922 1ed1  ...H........."..
        0x0030:  ea2b fa70                                .+.p
12:15:39.044249 IP di-admin.prod.imvu.com.50598 > AF002172.prod.imvu.com.9092: Flags [F.], seq 25, ack 1, win 229, options [nop,nop,TS val 3928758204 ecr 3911327441], length 0
        0x0000:  4500 0034 b7c3 4000 4006 5771 0a01 0f09  E..4..@.@.Wq....
        0x0010:  0a0a 087c c5a6 2384 1f69 4dc9 23f1 373f  ...|..#..iM.#.7?
        0x0020:  8011 00e5 2bb6 0000 0101 080a ea2c 17bc  ....+........,..
        0x0030:  e922 1ed1                                ."..
12:15:39.044653 IP AF002172.prod.imvu.com.9092 > di-admin.prod.imvu.com.50598: Flags [F.], seq 1, ack 26, win 7240, options [nop,nop,TS val 3911334942 ecr 3928758204], length 0
        0x0000:  4500 0034 29ef 4000 4006 e545 0a0a 087c  E..4).@.@..E...|
        0x0010:  0a01 0f09 2384 c5a6 23f1 373f 1f69 4dca  ....#...#.7?.iM.
        0x0020:  8011 1c48 562c 0000 0101 080a e922 3c1e  ...HV,......."<.
        0x0030:  ea2c 17bc                                .,..
12:15:39.044697 IP di-admin.prod.imvu.com.50598 > AF002172.prod.imvu.com.9092: Flags [.], ack 2, win 229, options [nop,nop,TS val 3928758205 ecr 3911334942], length 0
        0x0000:  4500 0034 b7c4 4000 4006 5770 0a01 0f09  E..4..@.@.Wp....
        0x0010:  0a0a 087c c5a6 2384 1f69 4dca 23f1 3740  ...|..#..iM.#.7@
        0x0020:  8010 00e5 2bb6 0000 0101 080a ea2c 17bd  ....+........,..
        0x0030:  e922 3c1e                                ."<.
12:15:39.295322 IP di-admin.prod.imvu.com.60415 > AF002173.prod.imvu.com.9092: Flags [S], seq 583015360, win 29200, options [mss 1400,sackOK,TS val 3928758267 ecr 0,nop,wscale 7], length 0
        0x0000:  4500 003c 0c3b 4000 4006 02f1 0a01 0f09  E..<.;@.@.......
        0x0010:  0a0a 087d ebff 2384 22c0 1bc0 0000 0000  ...}..#.".......
        0x0020:  a002 7210 2bbf 0000 0204 0578 0402 080a  ..r.+......x....
        0x0030:  ea2c 17fb 0000 0000 0103 0307            .,..........
12:15:39.295536 IP AF002173.prod.imvu.com.9092 > di-admin.prod.imvu.com.60415: Flags [S.], seq 3119590661, ack 583015361, win 28960, options [mss 1400,sackOK,TS val 3911326735 ecr 3928758267,nop,wscale 2], length 0
        0x0000:  4500 003c 0000 4000 4006 0f2c 0a0a 087d  E..<..@.@..,...}
        0x0010:  0a01 0f09 2384 ebff b9f1 2d05 22c0 1bc1  ....#.....-."...
        0x0020:  a012 7120 6f2a 0000 0204 0578 0402 080a  ..q.o*.....x....
        0x0030:  e922 1c0f ea2c 17fb 0103 0302            ."...,......
12:15:39.295555 IP di-admin.prod.imvu.com.60415 > AF002173.prod.imvu.com.9092: Flags [.], ack 1, win 229, options [nop,nop,TS val 3928758267 ecr 3911326735], length 0
        0x0000:  4500 0034 0c3c 4000 4006 02f8 0a01 0f09  E..4.<@.@.......
        0x0010:  0a0a 087d ebff 2384 22c0 1bc1 b9f1 2d06  ...}..#.".....-.
        0x0020:  8010 00e5 2bb7 0000 0101 080a ea2c 17fb  ....+........,..
        0x0030:  e922 1c0f                                ."..
12:15:39.295676 IP di-admin.prod.imvu.com.60415 > AF002173.prod.imvu.com.9092: Flags [P.], seq 1:25, ack 1, win 229, options [nop,nop,TS val 3928758267 ecr 3911326735], length 24
        0x0000:  4500 004c 0c3d 4000 4006 02df 0a01 0f09  E..L.=@.@.......
        0x0010:  0a0a 087d ebff 2384 22c0 1bc1 b9f1 2d06  ...}..#.".....-.
        0x0020:  8018 00e5 2bcf 0000 0101 080a ea2c 17fb  ....+........,..
        0x0030:  e922 1c0f 0000 0014 0003 0000 0000 0001  ."..............
        0x0040:  0006 7361 7261 6d61 0000 0000            ..sarama....
12:15:39.295800 IP AF002173.prod.imvu.com.9092 > di-admin.prod.imvu.com.60415: Flags [.], ack 25, win 7240, options [nop,nop,TS val 3911326735 ecr 3928758267], length 0
        0x0000:  4500 0034 3109 4000 4006 de2a 0a0a 087d  E..41.@.@..*...}
        0x0010:  0a01 0f09 2384 ebff b9f1 2d06 22c0 1bd9  ....#.....-."...
        0x0020:  8010 1c48 f275 0000 0101 080a e922 1c0f  ...H.u......."..
        0x0030:  ea2c 17fb                                .,..
12:16:09.295965 IP di-admin.prod.imvu.com.60415 > AF002173.prod.imvu.com.9092: Flags [F.], seq 25, ack 1, win 229, options [nop,nop,TS val 3928765767 ecr 3911326735], length 0
        0x0000:  4500 0034 0c3e 4000 4006 02f6 0a01 0f09  E..4.>@.@.......
        0x0010:  0a0a 087d ebff 2384 22c0 1bd9 b9f1 2d06  ...}..#.".....-.
        0x0020:  8011 00e5 2bb7 0000 0101 080a ea2c 3547  ....+........,5G
        0x0030:  e922 1c0f                                ."..
12:16:09.296352 IP AF002173.prod.imvu.com.9092 > di-admin.prod.imvu.com.60415: Flags [F.], seq 1, ack 26, win 7240, options [nop,nop,TS val 3911334235 ecr 3928765767], length 0
        0x0000:  4500 0034 310a 4000 4006 de29 0a0a 087d  E..41.@.@..)...}
        0x0010:  0a01 0f09 2384 ebff b9f1 2d06 22c0 1bda  ....#.....-."...
        0x0020:  8011 1c48 b7db 0000 0101 080a e922 395b  ...H........."9[
        0x0030:  ea2c 3547                                .,5G
12:16:09.296384 IP di-admin.prod.imvu.com.60415 > AF002173.prod.imvu.com.9092: Flags [.], ack 2, win 229, options [nop,nop,TS val 3928765767 ecr 3911334235], length 0
        0x0000:  4500 0034 0c3f 4000 4006 02f5 0a01 0f09  E..4.?@.@.......
        0x0010:  0a0a 087d ebff 2384 22c0 1bda b9f1 2d07  ...}..#.".....-.
        0x0020:  8010 00e5 2bb7 0000 0101 080a ea2c 3547  ....+........,5G
        0x0030:  e922 395b                                ."9[
12:16:09.296749 IP di-admin.prod.imvu.com.50639 > AF002172.prod.imvu.com.9092: Flags [S], seq 2843247636, win 29200, options [mss 1400,sackOK,TS val 3928765768 ecr 0,nop,wscale 7], length 0
        0x0000:  4500 003c b15c 4000 4006 5dd0 0a01 0f09  E..<.\@.@.].....
        0x0010:  0a0a 087c c5cf 2384 a978 8414 0000 0000  ...|..#..x......
        0x0020:  a002 7210 2bbe 0000 0204 0578 0402 080a  ..r.+......x....
        0x0030:  ea2c 3548 0000 0000 0103 0307            .,5H........
12:16:09.296913 IP AF002172.prod.imvu.com.9092 > di-admin.prod.imvu.com.50639: Flags [S.], seq 4177225384, ack 2843247637, win 28960, options [mss 1400,sackOK,TS val 3911342505 ecr 3928765768,nop,wscale 2], length 0
        0x0000:  4500 003c 0000 4000 4006 0f2d 0a0a 087c  E..<..@.@..-...|
        0x0010:  0a01 0f09 2384 c5cf f8fb 66a8 a978 8415  ....#.....f..x..
        0x0020:  a012 7120 d2b9 0000 0204 0578 0402 080a  ..q........x....
        0x0030:  e922 59a9 ea2c 3548 0103 0302            ."Y..,5H....
12:16:09.296933 IP di-admin.prod.imvu.com.50639 > AF002172.prod.imvu.com.9092: Flags [.], ack 1, win 229, options [nop,nop,TS val 3928765768 ecr 3911342505], length 0
        0x0000:  4500 0034 b15d 4000 4006 5dd7 0a01 0f09  E..4.]@.@.].....
        0x0010:  0a0a 087c c5cf 2384 a978 8415 f8fb 66a9  ...|..#..x....f.
        0x0020:  8010 00e5 2bb6 0000 0101 080a ea2c 3548  ....+........,5H
        0x0030:  e922 59a9                                ."Y.
12:16:09.297082 IP di-admin.prod.imvu.com.50639 > AF002172.prod.imvu.com.9092: Flags [P.], seq 1:25, ack 1, win 229, options [nop,nop,TS val 3928765768 ecr 3911342505], length 24
        0x0000:  4500 004c b15e 4000 4006 5dbe 0a01 0f09  E..L.^@.@.].....
        0x0010:  0a0a 087c c5cf 2384 a978 8415 f8fb 66a9  ...|..#..x....f.
        0x0020:  8018 00e5 2bce 0000 0101 080a ea2c 3548  ....+........,5H
        0x0030:  e922 59a9 0000 0014 0003 0000 0000 0001  ."Y.............
        0x0040:  0006 7361 7261 6d61 0000 0000            ..sarama....
12:16:09.297189 IP AF002172.prod.imvu.com.9092 > di-admin.prod.imvu.com.50639: Flags [.], ack 25, win 7240, options [nop,nop,TS val 3911342505 ecr 3928765768], length 0
        0x0000:  4500 0034 3f00 4000 4006 d034 0a0a 087c  E..4?.@.@..4...|
        0x0010:  0a01 0f09 2384 c5cf f8fb 66a9 a978 842d  ....#.....f..x.-
        0x0020:  8010 1c48 5605 0000 0101 080a e922 59a9  ...HV........"Y.
        0x0030:  ea2c 3548                                .,5H
12:16:30.803787 IP di-admin.prod.imvu.com.50639 > AF002172.prod.imvu.com.9092: Flags [F.], seq 25, ack 1, win 229, options [nop,nop,TS val 3928771144 ecr 3911342505], length 0
        0x0000:  4500 0034 b15f 4000 4006 5dd5 0a01 0f09  E..4._@.@.].....
        0x0010:  0a0a 087c c5cf 2384 a978 842d f8fb 66a9  ...|..#..x.-..f.
        0x0020:  8011 00e5 2bb6 0000 0101 080a ea2c 4a48  ....+........,JH
        0x0030:  e922 59a9                                ."Y.
12:16:30.804225 IP AF002172.prod.imvu.com.9092 > di-admin.prod.imvu.com.50639: Flags [F.], seq 1, ack 26, win 7240, options [nop,nop,TS val 3911347882 ecr 3928771144], length 0
        0x0000:  4500 0034 3f01 4000 4006 d033 0a0a 087c  E..4?.@.@..3...|
        0x0010:  0a01 0f09 2384 c5cf f8fb 66a9 a978 842e  ....#.....f..x..
        0x0020:  8011 1c48 2c02 0000 0101 080a e922 6eaa  ...H,........"n.
        0x0030:  ea2c 4a48                                .,JH
12:16:30.804252 IP di-admin.prod.imvu.com.50639 > AF002172.prod.imvu.com.9092: Flags [.], ack 2, win 229, options [nop,nop,TS val 3928771144 ecr 3911347882], length 0
        0x0000:  4500 0034 b160 4000 4006 5dd4 0a01 0f09  E..4.`@.@.].....
        0x0010:  0a0a 087c c5cf 2384 a978 842e f8fb 66aa  ...|..#..x....f.
        0x0020:  8010 00e5 2bb6 0000 0101 080a ea2c 4a48  ....+........,JH
        0x0030:  e922 6eaa                                ."n.

###### SARAMA:

Connecting...
SARAMA: 2017/02/07 12:14:39 client.go:110: Initializing new client
SARAMA: 2017/02/07 12:14:39 config.go:326: ClientID is the default of 'sarama', you should consider setting it to something application-specific.
SARAMA: 2017/02/07 12:14:39 config.go:326: ClientID is the default of 'sarama', you should consider setting it to something application-specific.
SARAMA: 2017/02/07 12:14:39 client.go:601: client/metadata fetching metadata for all topics from broker af002173:9092
SARAMA: 2017/02/07 12:14:39 broker.go:146: Connected to broker at af002173:9092 (unregistered)
SARAMA: 2017/02/07 12:15:09 client.go:620: client/metadata got error from broker while fetching metadata: read tcp 10.1.15.9:60375->10.10.8.125:9092: i/o timeout
SARAMA: 2017/02/07 12:15:09 broker.go:182: Closed connection to broker af002173:9092
SARAMA: 2017/02/07 12:15:09 config.go:326: ClientID is the default of 'sarama', you should consider setting it to something application-specific.
SARAMA: 2017/02/07 12:15:09 client.go:601: client/metadata fetching metadata for all topics from broker af002172:9092
SARAMA: 2017/02/07 12:15:09 broker.go:146: Connected to broker at af002172:9092 (unregistered)
SARAMA: 2017/02/07 12:15:39 client.go:620: client/metadata got error from broker while fetching metadata: read tcp 10.1.15.9:50598->10.10.8.124:9092: i/o timeout
SARAMA: 2017/02/07 12:15:39 broker.go:182: Closed connection to broker af002172:9092
SARAMA: 2017/02/07 12:15:39 client.go:626: client/metadata no available broker to send metadata request to
SARAMA: 2017/02/07 12:15:39 client.go:428: client/brokers resurrecting 2 dead seed brokers
SARAMA: 2017/02/07 12:15:39 client.go:590: client/metadata retrying after 250ms... (3 attempts remaining)
SARAMA: 2017/02/07 12:15:39 config.go:326: ClientID is the default of 'sarama', you should consider setting it to something application-specific.
SARAMA: 2017/02/07 12:15:39 client.go:601: client/metadata fetching metadata for all topics from broker af002173:9092
SARAMA: 2017/02/07 12:15:39 broker.go:146: Connected to broker at af002173:9092 (unregistered)
SARAMA: 2017/02/07 12:16:09 client.go:620: client/metadata got error from broker while fetching metadata: read tcp 10.1.15.9:60415->10.10.8.125:9092: i/o timeout
SARAMA: 2017/02/07 12:16:09 broker.go:182: Closed connection to broker af002173:9092
SARAMA: 2017/02/07 12:16:09 config.go:326: ClientID is the default of 'sarama', you should consider setting it to something application-specific.
SARAMA: 2017/02/07 12:16:09 client.go:601: client/metadata fetching metadata for all topics from broker af002172:9092
SARAMA: 2017/02/07 12:16:09 broker.go:146: Connected to broker at af002172:9092 (unregistered)

##### Problem Description

This cluster is happily being talked to by Haskell (using Franz library) and gobblin, which works well.
sarama, however, times out when trying to connect to the broker(s)

I would expect the code below (adapted from the example programs) to connect to a broker, retrieve a list of partitions for an existing topic, and print that list of partitions.
However, the NewConsumer() call never returns; there is some network traffic, but the connection times out, presumably without successfully negotiating a connection at the Kafka protocol layer.

Code to reproduce:

    package main
    
    import (
        "fmt"
        "github.com/Shopify/sarama"
        "log"
        "os"
        "strings"
    )
    
    func main() {
        sarama.Logger = log.New(os.Stderr, "SARAMA: ", log.Ldate|log.Ltime|log.Lshortfile)
        brokers := strings.Split("af002172:9092,af002173:9092", ",")
        fmt.Printf("Connecting...\n");
        c, err := sarama.NewConsumer(brokers, nil)
        if err != nil {
            die(fmt.Sprintf("Failed to open Kafka consumer: %s", err))
        }
        fmt.Printf("Getting partitions...\n");
        partitions, err := getPartitions(c, "imvu_event_data")
        if err != nil {
            die(fmt.Sprintf("Failed to get partition list for topic: %s", err))
        }
        fmt.Printf("Connected to partitions %s\n", partitions)
    }
    
    func die(s string) {
        fmt.Printf("kafka-slurp: irrecoverable error: %s", s);
        fmt.Println()
        os.Exit(2)
    }
    
    func getPartitions(c sarama.Consumer, topic string) ([]int32, error) {
        return c.Partitions(topic)
    }

**Comment by eapache** [comment]
Based on the logs from Sarama ("read tcp 10.1.15.9:60375->10.10.8.125:9092: i/o timeout") and the tcpdump trace (the request at 12:16:09.297082 is acked at the TCP layer but never responded to) I believe the broker is misbehaving. Please check the broker logs.

**Comment by eapache** [comment]
Closing as stale. Feel free to re-open if more information becomes available.
